#metadataBlock	dataverseAlias	displayName	name
0		JPL Core Metadata	0001_NASA_PDS_1.eimtldjplcoremetadata.JPL_Core_Metadata
#datasetField	advancedSearchField	allowControlledVocabulary	allowmultiples	description	displayFormat	displayOrder	displayoncreate	facetable	fieldType	metadatablock_id	name	parent	required	title
0	TRUE	TRUE	FALSE	An entity primarily responsible for making the resource. Facilitates discovery (search); allows content to be associated with JPLer.			TRUE	TRUE	text	0001_NASA_PDS_1.eimtldjplcoremetadata.JPL_Core_Metadata	0001_NASA_PDS_1.eimtldjplcoremetadata.JPL_Core_Metadata.eimtldjplcoremetadata.creator		FALSE	creator
1	TRUE	TRUE	FALSE	Date of creation of the resource. Vital for effective ERM and disposition.			TRUE	TRUE	text	0001_NASA_PDS_1.eimtldjplcoremetadata.JPL_Core_Metadata	0001_NASA_PDS_1.eimtldjplcoremetadata.JPL_Core_Metadata.eimtldjplcoremetadata.created		FALSE	created
2	TRUE	TRUE	FALSE	An unambiguous reference to the resource within a given context. Vital for effective ERM and disposition; facilitates “dashboard” use and reuse of content.			TRUE	TRUE	text	0001_NASA_PDS_1.eimtldjplcoremetadata.JPL_Core_Metadata	0001_NASA_PDS_1.eimtldjplcoremetadata.JPL_Core_Metadata.eimtldjplcoremetadata.identifier		FALSE	identifier
3	TRUE	TRUE	FALSE	A name given to the resource. Facilitates discovery (search).			TRUE	TRUE	text	0001_NASA_PDS_1.eimtldjplcoremetadata.JPL_Core_Metadata	0001_NASA_PDS_1.eimtldjplcoremetadata.JPL_Core_Metadata.eimtldjplcoremetadata.title		FALSE	title
4	TRUE	TRUE	FALSE	The file format, physical medium, or dimensions of the resource. Vital for effective ERM and disposition.			TRUE	TRUE	text	0001_NASA_PDS_1.eimtldjplcoremetadata.JPL_Core_Metadata	0001_NASA_PDS_1.eimtldjplcoremetadata.JPL_Core_Metadata.eimtldjplcoremetadata.format		FALSE	format
5	TRUE	TRUE	FALSE	The nature or genre of the resource. Facilitates discovery (search); vital for effective ERM and disposition; facilitates “dashboard” use and reuse of content.			TRUE	TRUE	text	0001_NASA_PDS_1.eimtldjplcoremetadata.JPL_Core_Metadata	0001_NASA_PDS_1.eimtldjplcoremetadata.JPL_Core_Metadata.eimtldjplcoremetadata.type		FALSE	type
6	TRUE	TRUE	FALSE	Information about rights held in and over the resource. Facilitates “dashboard” use and reuse of content.			TRUE	TRUE	text	0001_NASA_PDS_1.eimtldjplcoremetadata.JPL_Core_Metadata	0001_NASA_PDS_1.eimtldjplcoremetadata.JPL_Core_Metadata.eimtldjplcoremetadata.rights		FALSE	rights
7	TRUE	TRUE	FALSE	The topic of the resource per enterprise keywords.			TRUE	TRUE	text	0001_NASA_PDS_1.eimtldjplcoremetadata.JPL_Core_Metadata	0001_NASA_PDS_1.eimtldjplcoremetadata.JPL_Core_Metadata.eimtldjplcoremetadata.keywords		FALSE	keywords
#controlledVocabulary
